<?xml version="1.0" encoding="UTF-8" standalone="no"?>
<xs:schema xmlns="http://gadgetron.sf.net/gadgetron" xmlns:xs="http://www.w3.org/2001/XMLSchema" elementFormDefault="qualified" targetNamespace="http://gadgetron.sf.net/gadgetron">

    <!--
    Gadgetron configuration xml includes two sections: port and globalGadgetParameters
    The 'port' is where gadgetron is listening to. The 'globalGadgetParameters' section 
    lists the parameters which will be pre-set for all gadgets
    e.g. if 'workingDirectory' in the globalGadgetParameters is set, the dependency measurements
    will be stored and read from this directory. If it is not set, the default
    directory will be used ('/tmp/gadgetron' in linux and 'c:/temp/gadgetron' in windows).
    -->
    <xs:complexType name="Readers">
        <xs:sequence>
            <xs:element name="reader" type="Reader"/>
        </xs:sequence>
    </xs:complexType>

    <xs:complexType name="Writers">
        <xs:sequence>
            <xs:element name="reader" type="Reader"/>
        </xs:sequence>
    </xs:complexType>
    <xs:element name="configuration">
        <xs:complexType>
            <xs:all>
            <xs:element name="version" type="xs:string"/>
                <xs:element name="readers" type="Readers"/>
                <xs:element name="writers" type="Writers"/>
                <xs:element name="stream" type="Stream" />

            </xs:all>
        </xs:complexType>

    </xs:element>



  <xs:element name="gadgetronStreamConfiguration">
    <xs:complexType>
      <xs:sequence>
                <xs:element maxOccurs="unbounded" minOccurs="0" name="reader">
                    <xs:complexType>
                          <xs:sequence>
                              <xs:element name="slot" type="xs:unsignedShort"/>
                              <xs:element name="dll" type="xs:string"/>
                              <xs:element name="classname" type="xs:string"/>
                          </xs:sequence>
                      </xs:complexType>
                </xs:element>
                <xs:element maxOccurs="unbounded" minOccurs="0" name="writer">
                    <xs:complexType>
                          <xs:sequence>
                              <xs:element maxOccurs="1" minOccurs="1" name="slot" type="xs:unsignedShort"/>
                              <xs:element maxOccurs="1" minOccurs="1"  name="dll" type="xs:string"/>
                              <xs:element maxOccurs="1" minOccurs="1"  name="classname" type="xs:string"/>
                          </xs:sequence>
                      </xs:complexType>
                </xs:element>
                <xs:element maxOccurs="unbounded" minOccurs="0" name="gadget">
                    <xs:complexType>
                          <xs:sequence>
                              <xs:element maxOccurs="1" minOccurs="1"  name="name" type="xs:string"/>
                              <xs:element maxOccurs="1" minOccurs="1"  name="dll" type="xs:string"/>
                              <xs:element maxOccurs="1" minOccurs="1"  name="classname" type="xs:string"/>
                              <xs:element maxOccurs="unbounded" minOccurs="0" name="property">
                                  <xs:complexType>
                                      <xs:sequence>
                                          <xs:element maxOccurs="1" minOccurs="1" name="name" type="xs:string"/>
                                          <xs:element maxOccurs="1" minOccurs="1" name="value" type="xs:string"/>
                                      </xs:sequence>        
                                  </xs:complexType>
                              </xs:element>
                             </xs:sequence>
          </xs:complexType>
        </xs:element>
      </xs:sequence>
    </xs:complexType>
  </xs:element>
</xs:schema>
