<?xml version="1.0" encoding="UTF-8"?>
<gadgetronStreamConfiguration xsi:schemaLocation="http://gadgetron.sf.net/gadgetron gadgetron.xsd"
        xmlns="http://gadgetron.sf.net/gadgetron"
        xmlns:xsi="http://www.w3.org/2001/XMLSchema-instance">

    <writer>
        <slot>1019</slot>
        <dll>gadgetron_mricore</dll>
        <classname>DependencyQueryWriter</classname>
    </writer>

    <gadget>
        <name>NoiseSummary</name>
        <dll>gadgetron_mricore</dll>
        <classname>NoiseSummaryGadget</classname>

        <property>
            <name>noise_file</name>
            <value>NAMEOFNOISEFILE</value>
        </property>
    </gadget>

</gadgetronStreamConfiguration>
