<?xml version="1.0" encoding="UTF-8"?>
<gadgetronStreamConfiguration xsi:schemaLocation="http://gadgetron.sf.net/gadgetron gadgetron.xsd"
        xmlns="http://gadgetron.sf.net/gadgetron"
        xmlns:xsi="http://www.w3.org/2001/XMLSchema-instance">

    <reader>
        <slot>1008</slot>
        <dll>gadgetron_mricore</dll>
        <classname>GadgetIsmrmrdAcquisitionMessageReader</classname>
    </reader>
    <reader>
        <slot>1026</slot>
        <dll>gadgetron_mricore</dll>
        <classname>GadgetIsmrmrdWaveformMessageReader</classname>
    </reader>
 
    <writer>
      <slot>1022</slot>
      <dll>gadgetron_mricore</dll>
      <classname>MRIImageWriter</classname>
    </writer>

    <gadget>
        <name>RemoveROOversampling</name>
        <dll>gadgetron_mricore</dll>
        <classname>RemoveROOversamplingGadget</classname>
    </gadget>

    <gadget>
        <name>AccTrig</name>
        <dll>gadgetron_mricore</dll>
        <classname>AcquisitionAccumulateTriggerGadget</classname>
        <property>
            <name>trigger_dimension</name>
            <value>repetition</value>
        </property>
        <property>
          <name>sorting_dimension</name>
          <value>slice</value>
        </property>
    </gadget>

    <gadget>
        <name>Buff</name>
        <dll>gadgetron_mricore</dll>
        <classname>BucketToBufferGadget</classname>
        <property>
            <name>N_dimension</name>
            <value></value>
        </property>
        <property>
          <name>S_dimension</name>
          <value></value>
        </property>
        <property>
          <name>split_slices</name>
          <value>true</value>
        </property>
    </gadget>

     <gadget>
      <name>SimpleRecon</name>
      <dll>gadgetron_mricore</dll>
      <classname>SimpleReconGadget</classname>
     </gadget>

     <gadget>
      <name>ImageArraySplit</name>
      <dll>gadgetron_mricore</dll>
      <classname>ImageArraySplitGadget</classname>
     </gadget>

    <gadget>
      <name>Extract</name>
      <dll>gadgetron_mricore</dll>
      <classname>ExtractGadget</classname>
    </gadget>

    <gadget>
      <name>AutoScale</name>
      <dll>gadgetron_mricore</dll>
      <classname>AutoScaleGadget</classname>
    </gadget>

    <gadget>
      <name>FloatToShort</name>
      <dll>gadgetron_mricore</dll>
      <classname>FloatToUShortGadget</classname>
    </gadget>

     <gadget>
      <name>ImageFinish</name>
      <dll>gadgetron_mricore</dll>
      <classname>ImageFinishGadget</classname>
    </gadget>

</gadgetronStreamConfiguration>
