<?xml version="1.0" encoding="utf-8"?>
<gadgetronStreamConfiguration xsi:schemaLocation="http://gadgetron.sf.net/gadgetron gadgetron.xsd"
        xmlns="http://gadgetron.sf.net/gadgetron"
        xmlns:xsi="http://www.w3.org/2001/XMLSchema-instance">

    <!-- reader -->
    <reader><slot>1008</slot><dll>gadgetron_mricore</dll><classname>GadgetIsmrmrdAcquisitionMessageReader</classname></reader>
    <reader><slot>1026</slot><dll>gadgetron_mricore</dll><classname>GadgetIsmrmrdWaveformMessageReader</classname></reader>

    <!-- writer -->
    <writer><slot>1022</slot><dll>gadgetron_mricore</dll><classname>MRIImageWriter</classname></writer>

    <!-- Noise prewhitening -->
    <gadget><name>NoiseAdjust</name><dll>gadgetron_mricore</dll><classname>NoiseAdjustGadget</classname></gadget>

  <gadget>
    <name>PCA</name>
    <dll>gadgetron_mricore</dll>
    <classname>PCACoilGadget</classname>
  </gadget>

  <gadget>
    <name>CoilReduction</name>
    <dll>gadgetron_mricore</dll>
    <classname>CoilReductionGadget</classname>
    <property><name>coils_out</name><value>16</value></property>
  </gadget>

    <!-- Calculate spiral trajectory and attach -->
    <gadget>
        <name>SpiralToGeneric</name>
        <dll>gadgetron_spiral</dll>
        <classname>SpiralToGenericGadget</classname>
    </gadget>
    
    <!-- Data accumulation and trigger gadget -->
    <gadget>
        <name>AccTrig</name>
        <dll>gadgetron_mricore</dll>
        <classname>AcquisitionAccumulateTriggerGadget</classname>
        <property><name>trigger_dimension</name><value>repetition</value></property>
        <property><name>sorting_dimension</name><value></value></property>
    </gadget>

    <gadget>
        <name>BucketToBuffer</name>
        <dll>gadgetron_mricore</dll>
        <classname>BucketToBufferGadget</classname>
        <property><name>N_dimension</name><value>phase</value></property>
        <property><name>S_dimension</name><value>set</value></property>
        <property><name>split_slices</name><value>false</value></property>
        <property><name>ignore_segment</name><value>true</value></property>
        <property><name>verbose</name><value>true</value></property>
    </gadget>

    <gadget>
        <name>GriddingRecon</name>
        <dll>gadgetron_mri_noncartesian</dll>
        <classname>GriddingReconGadget</classname>
        <property><name>verbose</name><value>true</value></property>	
        <property><name>perform_timing</name><value>true</value></property>

	<!-- Ignore gridding weights, iterate instead -->
	<!--
	    <property><name>iterate</name><value>true</value></property>
	    <property><name>iteration_max</name><value>10</value></property>
	    <property><name>iteration_tol</name><value>1e-3</value></property>
	-->

	<!--
	    To measure SNR on frame 20 using pseudo replicas, enable lines below 
	    <property><name>replicas</name><value>256</value></property>
	    <property><name>snr_frame</name><value>20</value></property>
	-->
	
    </gadget>

    
    <!-- Image Array Scaling -->
    <gadget>
        <name>Scaling</name>
        <dll>gadgetron_mricore</dll>
        <classname>GenericReconImageArrayScalingGadget</classname>

        <!-- parameters for debug and timing -->
        <property><name>perform_timing</name><value>false</value></property>
        <property><name>verbose</name><value>false</value></property>

        <property><name>min_intensity_value</name><value>64</value></property>
        <property><name>max_intensity_value</name><value>4095</value></property>
        <property><name>scalingFactor</name><value>10.0</value></property>
        <property><name>use_constant_scalingFactor</name><value>true</value></property>
        <property><name>auto_scaling_only_once</name><value>true</value></property>
        <property><name>scalingFactor_dedicated</name><value>100.0</value></property>
    </gadget>

    <!-- ImageArray to images -->
    <gadget>
        <name>ImageArraySplit</name>
        <dll>gadgetron_mricore</dll>
        <classname>ImageArraySplitGadget</classname>
    </gadget>

    <!-- after recon processing -->
    <gadget>
        <name>ComplexToFloatAttrib</name>
        <dll>gadgetron_mricore</dll>
        <classname>ComplexToFloatGadget</classname>
    </gadget>

    <!--<gadget>-->
        <!--<name>FloatToShortAttrib</name>-->
        <!--<dll>gadgetron_mricore</dll>-->
        <!--<classname>FloatToUShortGadget</classname>-->

        <!--<property><name>max_intensity</name><value>32767</value></property>-->
        <!--<property><name>min_intensity</name><value>0</value></property>-->
        <!--<property><name>intensity_offset</name><value>0</value></property>-->
    <!--</gadget>-->
    <!---->
    <gadget>
        <name>ImageFinish</name>
        <dll>gadgetron_mricore</dll>
        <classname>ImageFinishGadget</classname>
    </gadget>

</gadgetronStreamConfiguration>
