<?xml version="1.0" encoding="utf-8"?>
<gadgetronStreamConfiguration xsi:schemaLocation="http://gadgetron.sf.net/gadgetron gadgetron.xsd"
        xmlns="http://gadgetron.sf.net/gadgetron"
        xmlns:xsi="http://www.w3.org/2001/XMLSchema-instance">

    <!--
        Gadgetron generic recon chain for 2D and 3D cartesian sampling

        RealTimeCine imaging
        Triggered by slice
        Recon N is phase and S is set

        Author: Hui Xue
        Magnetic Resonance Technology Program, National Heart, Lung and Blood Institute, National Institutes of Health
        10 Center Drive, Bethesda, MD 20814, USA
        Email: hui.xue@nih.gov
    -->

    <!-- reader -->
    <reader><slot>1008</slot><dll>gadgetron_mricore</dll><classname>GadgetIsmrmrdAcquisitionMessageReader</classname></reader>

    <!-- writer -->
    <writer><slot>1022</slot><dll>gadgetron_mricore</dll><classname>MRIImageWriter</classname></writer>

    <!-- Noise prewhitening -->
    <gadget><name>NoiseAdjust</name><dll>gadgetron_mricore</dll><classname>NoiseAdjustGadget</classname></gadget>

    <!-- RO asymmetric echo handling -->
    <gadget><name>AsymmetricEcho</name><dll>gadgetron_mricore</dll><classname>AsymmetricEchoAdjustROGadget</classname></gadget>

    <!-- RO oversampling removal -->
    <gadget><name>RemoveROOversampling</name><dll>gadgetron_mricore</dll><classname>RemoveROOversamplingGadget</classname></gadget>

    <!-- Data accumulation and trigger gadget -->
    <gadget>
        <name>AccTrig</name>
        <dll>gadgetron_mricore</dll>
        <classname>AcquisitionAccumulateTriggerGadget</classname>
        <property><name>trigger_dimension</name><value>slice</value></property>
        <property><name>sorting_dimension</name><value>slice</value></property>
    </gadget>

    <gadget>
        <name>Buff</name>
        <dll>gadgetron_mricore</dll>
        <classname>BucketToBufferGadget</classname>
        <property><name>N_dimension</name><value>phase</value></property>
        <property><name>S_dimension</name><value>set</value></property>
        <property><name>split_slices</name><value>true</value></property>
        <property><name>ignore_segment</name><value>true</value></property>
    </gadget>

    <!-- Prep ref -->
    <gadget>
        <name>PrepRef</name>
        <dll>gadgetron_mricore</dll>
        <classname>GenericCartesianReconReferencePrepGadget</classname>

        <!-- parameters for debug and timing -->
        <property><name>debug_folder</name><value>DebugFolder</value></property>
        <property><name>perform_timing</name><value>true</value></property>
        <property><name>verbose</name><value>true</value></property>

        <!-- averaging across repetition -->
        <property><name>average_all_ref_N</name><value>true</value></property>

        <!-- every set has its own kernels -->
        <property><name>average_all_ref_S</name><value>false</value></property>
    </gadget>

    <!-- Recon -->
    <gadget>
        <name>Recon</name>
        <dll>gadgetron_mricore</dll>
        <classname>GenericCartesianGrappaReconGadget</classname>

        <!-- image series -->
        <property><name>image_series</name><value>0</value></property>

        <!-- parameters for debug and timing -->
        <property><name>debug_folder</name><value>DebugFolder</value></property>
        <property><name>perform_timing</name><value>true</value></property>
        <property><name>verbose</name><value>true</value></property>

        <!-- whether to send out gfactor -->
        <property><name>send_out_gfactor</name><value>true</value></property>
    </gadget>

    <!-- Partial fourier handling -->
    <gadget>
        <name>PartialFourierHandling</name>
        <dll>gadgetron_mricore</dll>
        <classname>GenericReconPartialFourierHandlingPOCSGadget</classname>

        <!-- parameters for debug and timing -->
        <property><name>debug_folder</name><value>DebugFolder</value></property>
        <property><name>perform_timing</name><value>true</value></property>
        <property><name>verbose</name><value>true</value></property>

        <!-- if incoming images have this meta field, it will not be processed -->
        <property><name>skip_processing_meta_field</name><value>Skip_processing_after_recon</value></property>

        <!-- Parfial fourier POCS parameters -->
        <property><name>partial_fourier_POCS_iters</name><value>6</value></property>
        <property><name>partial_fourier_POCS_thres</name><value>0.01</value></property>
        <property><name>partial_fourier_POCS_transitBand</name><value>24</value></property>
        <property><name>partial_fourier_POCS_transitBand_E2</name><value>16</value></property>
    </gadget>

    <!-- ImageArray to images -->
    <gadget>
        <name>ImageArraySplit</name>
        <dll>gadgetron_mricore</dll>
        <classname>ImageArraySplitGadget</classname>
    </gadget>

    <!-- after recon processing -->
    <gadget>
        <name>ComplexToFloatAttrib</name>
        <dll>gadgetron_mricore</dll>
        <classname>ComplexToFloatGadget</classname>
    </gadget>

    <gadget>
        <name>ImageFinish</name>
        <dll>gadgetron_mricore</dll>
        <classname>ImageFinishGadget</classname>
    </gadget>

</gadgetronStreamConfiguration>
