<?xml version="1.0" encoding="UTF-8"?>
<gadgetronStreamConfiguration xsi:schemaLocation="http://gadgetron.sf.net/gadgetron gadgetron.xsd"
                  xmlns="http://gadgetron.sf.net/gadgetron"
                  xmlns:xsi="http://www.w3.org/2001/XMLSchema-instance">

    <!-- SNR unit noise adjust gadget
         If the scan has asymmetric readout, the center of echo will shifted to the index 0
         Zeros will be filled into the readout data
    -->
    <gadget>
        <name>NoiseAdjust</name>
        <dll>pingvin_mricore</dll>
        <classname>NoiseAdjustGadget</classname>

        <!-- Whether to pass the nonconformant data without applying the prewhitening -->
        <property>
            <name>pass_nonconformant_data</name>
            <value>true</value>
        </property>
    </gadget>

</gadgetronStreamConfiguration>
