<?xml version="1.0" encoding="UTF-8"?>
<gadgetronStreamConfiguration xsi:schemaLocation="http://gadgetron.sf.net/gadgetron gadgetron.xsd"
        xmlns="http://gadgetron.sf.net/gadgetron"
        xmlns:xsi="http://www.w3.org/2001/XMLSchema-instance">

    <writer>
        <slot>1019</slot>
        <dll>gadgetron_mricore</dll>
        <classname>DependencyQueryWriter</classname>
    </writer>

    <gadget>
        <name>DependencyQuery</name>
        <dll>gadgetron_mricore</dll>
        <classname>DependencyQueryGadget</classname>

        <!-- If set to true, check the file creation time and delete old stored files -->
        <property>
            <name>clean_storage_while_query</name>
            <value>true</value>
        </property>

        <!-- In the unit of hours, the maximal time duration allowed for a file stored
             If clean_storage_while_query == true, this time limit will be used to 
             determine which files to be deleted
         -->
        <property>
            <name>time_limit_in_storage</name>
            <value>24.0</value>
        </property>
    </gadget>

</gadgetronStreamConfiguration>
