<?xml version="1.0" encoding="UTF-8"?>
<gadgetronStreamConfiguration xsi:schemaLocation="http://gadgetron.sf.net/gadgetron gadgetron.xsd"
        xmlns="http://gadgetron.sf.net/gadgetron"
        xmlns:xsi="http://www.w3.org/2001/XMLSchema-instance">
         
    <reader>
      <slot>1008</slot>
      <dll>gadgetron_mricore</dll>
      <classname>GadgetIsmrmrdAcquisitionMessageReader</classname>
    </reader>
 
     <writer>
      <slot>1022</slot>
      <dll>gadgetron_mricore</dll>
      <classname>MRIImageWriter</classname>
    </writer>

    <gadget>
      <name>NoiseAdjust</name>
      <dll>gadgetron_mricore</dll>
      <classname>NoiseAdjustGadget</classname>
    </gadget>

   <gadget>
      <name>PCA</name>
      <dll>gadgetron_mricore</dll>
      <classname>PCACoilGadget</classname>
    </gadget>

    <gadget>
      <name>CoilReduction</name>
      <dll>gadgetron_mricore</dll>
      <classname>CoilReductionGadget</classname>
      <property><name>coils_out</name><value>16</value></property>
    </gadget>
    
    <gadget>
      <name>RemoveROOversampling</name>
      <dll>gadgetron_mricore</dll>
      <classname>RemoveROOversamplingGadget</classname>
    </gadget>

    <gadget>
      <name>Grappa</name>
      <dll>gadgetron_grappa</dll>
      <classname>GrappaGadget</classname>
      <property><name>target_coils</name><value>8</value></property>
    </gadget>

    <gadget>
      <name>GrappaUnmixing</name>
      <dll>gadgetron_grappa</dll>
      <classname>GrappaUnmixingGadget</classname>
    </gadget>

     <gadget>
      <name>Extract</name>
      <dll>gadgetron_mricore</dll>
      <classname>ExtractGadget</classname>
    </gadget>

    <!--
    <gadget>
      <name>ImageWrite</name>
      <dll>gadgetron_mricore</dll>
      <classname>ImageWriterGadgetFLOAT</classname>
    </gadget>
    -->

    <gadget>
      <name>AutoScale</name>
      <dll>gadgetron_mricore</dll>
      <classname>AutoScaleGadget</classname>
    </gadget>
    
    <gadget>
      <name>FloatToShort</name>
      <dll>gadgetron_mricore</dll>
      <classname>FloatToUShortGadget</classname>
    </gadget>

    <gadget>
      <name>ImageFinish</name>
      <dll>gadgetron_mricore</dll>
      <classname>ImageFinishGadget</classname>
    </gadget>

</gadgetronStreamConfiguration>
