<?xml version="1.0" encoding="UTF-8"?>
<gadgetronStreamConfiguration xsi:schemaLocation="http://gadgetron.sf.net/gadgetron gadgetron.xsd"
			      xmlns="http://gadgetron.sf.net/gadgetron"
			      xmlns:xsi="http://www.w3.org/2001/XMLSchema-instance">

  <reader>
    <slot>1008</slot>
    <dll>gadgetron_mricore</dll>
    <classname>GadgetIsmrmrdAcquisitionMessageReader</classname>
  </reader>

  <writer>
    <slot>1022</slot>
    <dll>gadgetron_mricore</dll>
    <classname>MRIImageWriter</classname>
  </writer>

    <gadget>
        <name>AccTrig</name>
        <dll>gadgetron_mricore</dll>
        <classname>AcquisitionAccumulateTriggerGadget</classname>
        <property>
            <name>trigger_dimension</name>
            <value>repetition</value>
        </property>
    </gadget>

    <gadget>
        <name>Buff</name>
        <dll>gadgetron_mricore</dll>
        <classname>BucketToBufferGadget</classname>
        <property>
            <name>N_dimension</name>
            <value></value>
        </property>
        <property>
          <name>S_dimension</name>
          <value></value>
        </property>
        <property>
          <name>split_slice</name>
          <value>true</value>
        </property>
    </gadget>


  <gadget>
    <name>MatlabBuffer</name>
    <dll>gadgetron_matlab</dll>
    <classname>MatlabBufferGadget</classname>
    <property><name>debug_mode</name><value>1</value></property>
    <property><name>matlab_path</name><value></value></property>
    <property><name>matlab_classname</name><value>trajectoryScale</value></property>
    <property><name>matlab_port</name><value>3000</value></property>
  </gadget>
  <gadget>
    <name>Combine</name>
    <dll>gadgetron_mricore</dll>
    <classname>CombineGadget</classname>
  </gadget>
  <gadget>
    <name>Extract</name>
    <dll>gadgetron_mricore</dll>
    <classname>ExtractGadget</classname>
  </gadget>
  <gadget>
    <name>ImageFinish</name>
    <dll>gadgetron_mricore</dll>
    <classname>ImageFinishGadget</classname>
  </gadget>
</gadgetronStreamConfiguration>
