<?xml version="1.0" encoding="utf-8"?>
<gadgetronStreamConfiguration xsi:schemaLocation="http://gadgetron.sf.net/gadgetron gadgetron.xsd"
        xmlns="http://gadgetron.sf.net/gadgetron"
        xmlns:xsi="http://www.w3.org/2001/XMLSchema-instance">

    <gadget>
        <name>FloatToShortAttrib</name>
        <dll>gadgetron_mricore</dll>
        <classname>FloatToUShortGadget</classname>

        <property><name>max_intensity</name><value>32767</value></property>
        <property><name>min_intensity</name><value>0</value></property>
        <property><name>intensity_offset</name><value>0</value></property>
    </gadget>

</gadgetronStreamConfiguration>
