<?xml version="1.0" encoding="UTF-8"?>
<gadgetronStreamConfiguration xsi:schemaLocation="http://gadgetron.sf.net/gadgetron gadgetron.xsd"
        xmlns="http://gadgetron.sf.net/gadgetron"
        xmlns:xsi="http://www.w3.org/2001/XMLSchema-instance">
        
    <reader>
      <slot>1008</slot>
      <dll>gadgetron_mricore</dll>
      <classname>GadgetIsmrmrdAcquisitionMessageReader</classname>
    </reader>
  
    <writer>
      <slot>1004</slot>
      <dll>gadgetron_mricore</dll>
      <classname>MRIImageWriterCPLX</classname>
    </writer>
    <writer>
      <slot>1005</slot>
      <dll>gadgetron_mricore</dll>
      <classname>MRIImageWriterFLOAT</classname>
    </writer>
    <writer>
      <slot>1006</slot>
      <dll>gadgetron_mricore</dll>
      <classname>MRIImageWriterUSHORT</classname>
    </writer>
  
    <gadget>
        <name>RemoveROOversampling</name>
        <dll>gadgetron_mricore</dll>
	<classname>RemoveROOversamplingGadget</classname>
        <property>
            <name>constant_noise_variance</name>
            <value>false</value>
        </property>
    </gadget>

    <gadget>
        <name>AccTrig</name>
        <dll>gadgetron_mricore</dll>
	<classname>AcquisitionAccumulateTriggerGadget</classname>
        <property>
            <name>trigger_dimension</name>
            <value>repetition</value>
        </property>
        <property>
          <name>sorting_dimension</name>
          <value>slice</value>
        </property>
    </gadget>

    <gadget>
        <name>Buff</name>
        <dll>gadgetron_mricore</dll>
	<classname>BucketToBufferGadget</classname>
        <property>
            <name>N_dimension</name>
            <value></value>
        </property>
        <property>
          <name>S_dimension</name>
          <value></value>
        </property>
        <property>
          <name>split_slices</name>
          <value>true</value>
        </property>
    </gadget>

     <gadget>
      <name>FFT</name>
      <dll>gadgetron_mricore</dll>
      <classname>FFTGadget</classname>
     </gadget>

    <gadget>
      <name>Combine</name>
      <dll>gadgetron_mricore</dll>
      <classname>CombineGadget</classname>
    </gadget>

    <gadget>
      <name>Extract</name>
      <dll>gadgetron_mricore</dll>
      <classname>ExtractGadget</classname>
    </gadget>  

    <gadget>
      <name>ImageFinishFLOAT</name>
      <dll>gadgetron_mricore</dll>
      <classname>ImageFinishGadgetFLOAT</classname>
    </gadget>

</gadgetronStreamConfiguration>
