<?xml version="1.0" encoding="utf-8"?>
<gadgetronStreamConfiguration xsi:schemaLocation="http://gadgetron.sf.net/gadgetron gadgetron.xsd"
        xmlns="http://gadgetron.sf.net/gadgetron"
        xmlns:xsi="http://www.w3.org/2001/XMLSchema-instance">

    <!-- reader -->
    <reader><slot>1008</slot><dll>gadgetron_mricore</dll><classname>GadgetIsmrmrdAcquisitionMessageReader</classname></reader>
    <reader><slot>1026</slot><dll>gadgetron_mricore</dll><classname>GadgetIsmrmrdWaveformMessageReader</classname></reader>

    <!-- writer -->
    <writer><slot>1022</slot><dll>gadgetron_mricore</dll><classname>MRIImageWriter</classname></writer>

    <!-- Noise prewhitening -->
    <gadget><name>NoiseAdjust</name><dll>gadgetron_mricore</dll><classname>NoiseAdjustGadget</classname></gadget>

    <!-- RO asymmetric echo handling -->
    <gadget><name>AsymmetricEcho</name><dll>gadgetron_mricore</dll><classname>AsymmetricEchoAdjustROGadget</classname></gadget>

    <!-- RO oversampling removal -->
    <gadget><name>RemoveROOversampling</name><dll>gadgetron_mricore</dll><classname>RemoveROOversamplingGadget</classname></gadget>

    <!-- Data accumulation and trigger gadget -->
    <gadget>
        <name>AccTrig</name>
        <dll>gadgetron_mricore</dll>
        <classname>AcquisitionAccumulateTriggerGadget</classname>
        <property><name>trigger_dimension</name><value></value></property>
        <property><name>sorting_dimension</name><value></value></property>
    </gadget>

    <gadget>
        <name>BucketToBuffer</name>
        <dll>gadgetron_mricore</dll>
        <classname>BucketToBufferGadget</classname>
        <property><name>N_dimension</name><value>repetition</value></property>
        <property><name>S_dimension</name><value>set</value></property>
        <property><name>split_slices</name><value>false</value></property>
        <property><name>ignore_segment</name><value>true</value></property>
        <property><name>verbose</name><value>false</value></property>
    </gadget>

    <!-- Prep ref -->
    <gadget>
        <name>PrepRef</name>
        <dll>gadgetron_mricore</dll>
        <classname>GenericReconCartesianReferencePrepGadget</classname>

        <!-- parameters for debug and timing -->
        <property><name>debug_folder</name><value></value></property>
        <property><name>perform_timing</name><value>true</value></property>
        <property><name>verbose</name><value>false</value></property>

        <!-- averaging across repetition -->
        <property><name>average_all_ref_N</name><value>true</value></property>
        <!-- every set has its own kernels -->
        <property><name>average_all_ref_S</name><value>true</value></property>
        <!-- whether always to prepare ref if no acceleration is used -->
        <property><name>prepare_ref_always</name><value>true</value></property>
    </gadget>

    <!-- Recon -->
    <gadget>
        <name>Recon</name>
        <dll>gadgetron_mricore</dll>
        <classname>GenericReconOpenReconDemoGadget</classname>

        <!-- parameters for debug and timing -->
        <property><name>debug_folder</name><value></value></property>
        <property><name>perform_timing</name><value>true</value></property>
        <property><name>verbose</name><value>true</value></property>
    </gadget>

    <!-- ImageArray to images -->
    <gadget>
        <name>ImageArraySplit</name>
        <dll>gadgetron_mricore</dll>
        <classname>ImageArraySplitGadget</classname>
    </gadget>

    <!-- after recon processing -->
    <gadget>
        <name>ComplexToFloatAttrib</name>
        <dll>gadgetron_mricore</dll>
        <classname>ComplexToFloatGadget</classname>
    </gadget>

    <gadget>
        <name>FloatToShortAttrib</name>
        <dll>gadgetron_mricore</dll>
        <classname>FloatToUShortGadget</classname>

        <property><name>max_intensity</name><value>32767</value></property>
        <property><name>min_intensity</name><value>-32767</value></property>
        <property><name>intensity_offset</name><value>0</value></property>
    </gadget>

    <gadget>
        <name>ImageFinish</name>
        <dll>gadgetron_mricore</dll>
        <classname>ImageFinishGadget</classname>
    </gadget>

</gadgetronStreamConfiguration>
