<?xml version="1.0" encoding="utf-8"?>
<gadgetronStreamConfiguration xsi:schemaLocation="http://gadgetron.sf.net/gadgetron gadgetron.xsd"
        xmlns="http://gadgetron.sf.net/gadgetron"
        xmlns:xsi="http://www.w3.org/2001/XMLSchema-instance">

    <!-- Image Array Scaling -->
    <gadget>
        <name>Scaling</name>
        <dll>gadgetron_mricore</dll>
        <classname>GenericReconImageArrayScalingGadget</classname>

        <!-- parameters for debug and timing -->
        <property><name>perform_timing</name><value>false</value></property>
        <property><name>verbose</name><value>false</value></property>

        <property><name>min_intensity_value</name><value>64</value></property>
        <property><name>max_intensity_value</name><value>4095</value></property>
        <property><name>scalingFactor</name><value>10.0</value></property>
        <property><name>use_constant_scalingFactor</name><value>true</value></property>
        <property><name>auto_scaling_only_once</name><value>true</value></property>
        <property><name>scalingFactor_dedicated</name><value>100.0</value></property>
    </gadget>

</gadgetronStreamConfiguration>
