<?xml version="1.0" encoding="UTF-8"?>
<gadgetronStreamConfiguration xsi:schemaLocation="http://gadgetron.sf.net/gadgetron gadgetron.xsd"
        xmlns="http://gadgetron.sf.net/gadgetron"
        xmlns:xsi="http://www.w3.org/2001/XMLSchema-instance">

    <reader>
        <slot>1008</slot>
        <dll>gadgetron_mricore</dll>
        <classname>GadgetIsmrmrdAcquisitionMessageReader</classname>
    </reader>
    <reader>
        <slot>1026</slot>
        <dll>gadgetron_mricore</dll>
        <classname>GadgetIsmrmrdWaveformMessageReader</classname>
    </reader>

    <writer>
      <slot>1022</slot>
      <dll>gadgetron_mricore</dll>
      <classname>MRIImageWriter</classname>
    </writer>

    <gadget>
      <name>RemoveOversamplingPython</name>
      <dll>gadgetron_python</dll>
      <classname>PythonGadget</classname>
      <property><name>python_path</name>                  <value>/home/myuser/scripts/python</value></property>
      <property><name>python_module</name>                <value>remove_2x_oversampling</value></property>
      <property><name>python_class</name>                <value>Remove2xOversampling</value></property>
    </gadget>

    <gadget>
      <name>AccReconPython</name>
      <dll>gadgetron_python</dll>
      <classname>PythonGadget</classname>
      <property><name>python_path</name>                  <value>/home/myuser/scripts/python</value></property>
      <property><name>python_module</name>                <value>accumulate_and_recon</value></property>
      <property><name>python_class</name>                <value>AccumulateAndRecon</value></property>
    </gadget>

    <gadget>
      <name>CoilCombinePython</name>
      <dll>gadgetron_python</dll>
      <classname>PythonGadget</classname>
      <property><name>python_path</name>                  <value>/home/myuser/scripts/python</value></property>
      <property><name>python_module</name>                <value>rms_coil_combine</value></property>
      <property><name>python_class</name>                <value>RMSCoilCombine</value></property>
    </gadget>

     <gadget>
      <name>Extract</name>
      <dll>gadgetron_mricore</dll>
      <classname>ExtractGadget</classname>
     </gadget>

     <gadget>
      <name>Autoscale</name>
      <dll>gadgetron_mricore</dll>
      <classname>AutoScaleGadget</classname>
     </gadget>
    
     <gadget>
      <name>FloatToShort</name>
      <dll>gadgetron_mricore</dll>
      <classname>FloatToUShortGadget</classname>
    </gadget>
  
    <gadget>
      <name>ImageFinish</name>
      <dll>gadgetron_mricore</dll>
      <classname>ImageFinishGadget</classname>
    </gadget>

</gadgetronStreamConfiguration>
